{
  "civs": {
    "Armenians": {
      "automatic": [],
      "free": []
    },
    "Aztecs": {
      "automatic": [],
      "free": []
    },
    "Bengalis": {
      "automatic": [],
      "free": []
    },
    "Berbers": {
      "automatic": [],
      "free": []
    },
    "Bohemians": {
      "automatic": [],
      "free": []
    },
    "Britons": {
      "automatic": [],
      "free": []
    },
    "Bulgarians": {
      "automatic": [],
      "free": []
    },
    "Burgundians": {
      "automatic": [],
      "free": []
    },
    "Burmese": {
      "automatic": [],
      "free": []
    },
    "Byzantines": {
      "automatic": [],
      "free": []
    },
    "Celts": {
      "automatic": [],
      "free": []
    },
    "Chinese": {
      "automatic": [],
      "free": []
    },
    "Cumans": {
      "automatic": [],
      "free": []
    },
    "Danes": {
      "automatic": [],
      "free": []
    },
    "Dravidians": {
      "automatic": [],
      "free": []
    },
    "Ethiopians": {
      "automatic": [],
      "free": []
    },
    "Franks": {
      "automatic": [],
      "free": []
    },
    "Georgians": {
      "automatic": [],
      "free": []
    },
    "Goths": {
      "automatic": [],
      "free": []
    },
    "Gurjaras": {
      "automatic": [],
      "free": []
    },
    "Hindustanis": {
      "automatic": [],
      "free": []
    },
    "Huns": {
      "automatic": [],
      "free": []
    },
    "Incas": {
      "automatic": [],
      "free": []
    },
    "Italians": {
      "automatic": [],
      "free": []
    },
    "Japanese": {
      "automatic": [],
      "free": []
    },
    "Jurchens": {
      "automatic": [],
      "free": []
    },
    "Khitans": {
      "automatic": [],
      "free": []
    },
    "Khmer": {
      "automatic": [],
      "free": []
    },
    "Koreans": {
      "automatic": [],
      "free": []
    },
    "Lithuanians": {
      "automatic": [],
      "free": []
    },
    "Magyars": {
      "automatic": [],
      "free": []
    },
    "Malay": {
      "automatic": [],
      "free": []
    },
    "Malians": {
      "automatic": [],
      "free": []
    },
    "Mapuche": {
      "automatic": [],
      "free": []
    },
    "Mayans": {
      "automatic": [],
      "free": []
    },
    "Mongols": {
      "automatic": [],
      "free": []
    },
    "Muisca": {
      "automatic": [],
      "free": []
    },
    "Persians": {
      "automatic": [],
      "free": []
    },
    "Poles": {
      "automatic": [],
      "free": []
    },
    "Portuguese": {
      "automatic": [],
      "free": []
    },
    "Romans": {
      "automatic": [],
      "free": []
    },
    "Saracens": {
      "automatic": [],
      "free": []
    },
    "Saxons": {
      "automatic": [
        {
          "count": 1,
          "effects": [
            {
              "op": "add",
              "stat": "total",
              "unit": 79,
              "value": 1.0
            },
            {
              "op": "add",
              "stat": "total",
              "unit": 234,
              "value": 1.0
            },
            {
              "op": "add",
              "stat": "total",
              "unit": 235,
              "value": 1.0
            },
            {
              "op": "add",
              "stat": "max",
              "unit": 79,
              "value": 1.0
            },
            {
              "op": "add",
              "stat": "max",
              "unit": 234,
              "value": 1.0
            },
            {
              "op": "add",
              "stat": "max",
              "unit": 235,
              "value": 1.0
            }
          ],
          "id": 1493,
          "requires": [
            102
          ]
        }
      ],
      "free": []
    },
    "Shu": {
      "automatic": [],
      "free": []
    },
    "Sicilians": {
      "automatic": [],
      "free": []
    },
    "Slavs": {
      "automatic": [],
      "free": []
    },
    "Spanish": {
      "automatic": [],
      "free": []
    },
    "Tatars": {
      "automatic": [],
      "free": []
    },
    "Teutons": {
      "automatic": [
        {
          "count": 0,
          "effects": [
            {
              "op": "add",
              "stat": "capacity",
              "unit": 109,
              "value": 10.0
            },
            {
              "op": "add",
              "stat": "max",
              "unit": 109,
              "value": 5.0
            }
          ],
          "id": 336,
          "requires": []
        },
        {
          "count": 0,
          "effects": [
            {
              "op": "add",
              "stat": "capacity",
              "unit": 79,
              "value": 5.0
            },
            {
              "op": "add",
              "stat": "capacity",
              "unit": 234,
              "value": 5.0
            },
            {
              "op": "add",
              "stat": "capacity",
              "unit": 235,
              "value": 5.0
            },
            {
              "op": "add",
              "stat": "max",
              "unit": 79,
              "value": 4.0
            },
            {
              "op": "add",
              "stat": "max",
              "unit": 234,
              "value": 4.0
            },
            {
              "op": "add",
              "stat": "max",
              "unit": 235,
              "value": 4.0
            }
          ],
          "id": 353,
          "requires": []
        }
      ],
      "free": []
    },
    "Tupi": {
      "automatic": [],
      "free": []
    },
    "Turks": {
      "automatic": [],
      "free": [
        47
      ]
    },
    "Varangians": {
      "automatic": [],
      "free": []
    },
    "Vietnamese": {
      "automatic": [],
      "free": []
    },
    "Vikings": {
      "automatic": [],
      "free": []
    },
    "Wei": {
      "automatic": [],
      "free": []
    },
    "Wu": {
      "automatic": [],
      "free": []
    }
  },
  "conditional": [
    {
      "count": 2,
      "effects": [
        {
          "op": "add",
          "stat": "attack",
          "unit": 79,
          "value": 1
        },
        {
          "op": "add",
          "stat": "attack",
          "unit": 234,
          "value": 1
        },
        {
          "op": "add",
          "stat": "attack",
          "unit": 235,
          "value": 1
        }
      ],
      "id": 610,
      "requires": [
        608,
        140,
        775
      ]
    },
    {
      "count": 2,
      "effects": [
        {
          "op": "add",
          "stat": "attack",
          "unit": 79,
          "value": 1
        },
        {
          "op": "add",
          "stat": "attack",
          "unit": 234,
          "value": 1
        },
        {
          "op": "add",
          "stat": "attack",
          "unit": 235,
          "value": 1
        }
      ],
      "id": 611,
      "requires": [
        608,
        63,
        775
      ]
    }
  ],
  "meta": {
    "commit": "e293dc106b0f3b0ceac2db98409fbcc5c921190b",
    "generatedBy": "scripts/garrison_build.py",
    "patch": "DE Update 188329 (2026-10-28)",
    "repo": "SiegeEngineers/auto-mods",
    "sha256": "d0aefd92428e2215d6f4d9b1d544901e6f171e19183f9e0b88218de5153a337f"
  },
  "techs": {
    "199": {
      "count": 1,
      "effects": [
        {
          "op": "add",
          "stat": "attack",
          "unit": 79,
          "value": 1
        },
        {
          "op": "add",
          "stat": "attack",
          "unit": 234,
          "value": 1
        },
        {
          "op": "add",
          "stat": "attack",
          "unit": 235,
          "value": 1
        },
        {
          "op": "add",
          "stat": "attack",
          "unit": 109,
          "value": 1
        },
        {
          "op": "add",
          "stat": "firepower",
          "unit": 83,
          "value": -0.5
        },
        {
          "op": "add",
          "stat": "firepower",
          "unit": 293,
          "value": -0.5
        }
      ],
      "id": 199,
      "requires": [
        101
      ]
    },
    "200": {
      "count": 2,
      "effects": [
        {
          "op": "add",
          "stat": "attack",
          "unit": 79,
          "value": 1
        },
        {
          "op": "add",
          "stat": "attack",
          "unit": 234,
          "value": 1
        },
        {
          "op": "add",
          "stat": "attack",
          "unit": 235,
          "value": 1
        },
        {
          "op": "add",
          "stat": "attack",
          "unit": 109,
          "value": 1
        },
        {
          "op": "add",
          "stat": "firepower",
          "unit": 83,
          "value": -0.5
        },
        {
          "op": "add",
          "stat": "firepower",
          "unit": 293,
          "value": -0.5
        }
      ],
      "id": 200,
      "requires": [
        102,
        199
      ]
    },
    "201": {
      "count": 2,
      "effects": [
        {
          "op": "add",
          "stat": "attack",
          "unit": 79,
          "value": 1
        },
        {
          "op": "add",
          "stat": "attack",
          "unit": 234,
          "value": 1
        },
        {
          "op": "add",
          "stat": "attack",
          "unit": 235,
          "value": 1
        },
        {
          "op": "add",
          "stat": "attack",
          "unit": 109,
          "value": 1
        },
        {
          "op": "add",
          "stat": "firepower",
          "unit": 83,
          "value": -0.5
        },
        {
          "op": "add",
          "stat": "firepower",
          "unit": 293,
          "value": -0.5
        }
      ],
      "id": 201,
      "requires": [
        103,
        200
      ]
    },
    "3": {
      "count": 1,
      "effects": [
        {
          "op": "add",
          "stat": "attack",
          "unit": 79,
          "value": 2
        },
        {